{
  "event_id": "66666666-6666-4666-8666-666666666666",
  "event_type": "customer_transaction",
  "schema_version": "1.0",
  "source": "historical_customer_generator",
  "event_timestamp": "2026-01-15T12:00:00Z",
  "source_timestamp": "2026-01-15T12:00:01Z",
  "ingestion_timestamp": "2026-01-15T12:00:02Z",
  "transaction_id": "77777777-7777-4777-8777-777777777777",
  "account_id": "11111111-1111-4111-8111-111111111111",
  "asset": "BTC",
  "crypto_quantity": 0.005,
  "transaction_type": "WITHDRAWAL",
  "source_wallet_id": "33333333-3333-4333-8333-333333333333",
  "destination_wallet_id": "88888888-8888-4888-8888-888888888888",
  "device_id": "22222222-2222-4222-8222-222222222222",
  "country": "US",
  "market_price_usd": 40000.0,
  "transaction_amount_usd": 200.0,
  "transaction_status": "COMPLETED"
}
